<?xml version="1.0" encoding="utf-8" ?>
<!DOCTYPE Level SYSTEM "Levels.dtd">
<Level>

  <Includes>
    <Include name="Level\RobotTemplates.xml"/>
    <Include name="Level\IslandTemplates.xml"/>
  </Includes>
  
  <!-- abstract game entities (templates) -->


  <Entity name="camera_base" abstract="true">
    <Attributes>
      <Attribute name="kind" template="string" value="camera"/>
      <Attribute name="position" template="float3" value="0 420 1065"/>
      <!--Attribute name="position" template="float3" value="0 420 1065"/-->
      <Attribute name="target" template="float3" value="0 180 0"/>
      <Attribute name="up" template="float3" value="0 1 0"/>
      <Attribute name="fov" template="float" value="33"/>
      <Attribute name="near_clip" template="float" value="1"/>
      <Attribute name="far_clip" template="float" value="10000"/>
    </Attributes>
    <Properties>
      <Property name="camera" type="ProjectMagma.Simulation.CameraProperty"/>
    </Properties>
  </Entity>

  <Entity name="lava_base" abstract="true">
    <Attributes>
      <Attribute name="kind" template="string" value="lava"/>
      <Attribute name="position" template="float3" value="0 0 0"/>
      <!--Attribute name="scale" template="float3" value="0.8 0.12 0.8"/-->
      <Attribute name="scale" template="float3" value="800 120 800"/>
      <!--Attribute name="scale" template="float3" value="1200 4 1200"/-->
      <!--Attribute name="mesh" template="string" value="Models\Environment\lava6c_wrongdir"/-->
      <Attribute name="mesh" template="string" value="Models\Environment\lava6c"/>
      <!--Attribute name="mesh" template="string" value="Models\Primitives\lava_primitive"/-->
      <Attribute name="sparsestucco_texture" template="string" value="Textures/Lava/sparsestucco"/>
      <Attribute name="firefractal_texture" template="string" value="Textures/Lava/firefractal"/>
      <Attribute name="vectorcloud_texture" template="string" value="Textures/Lava/vectorclouds"/>
      <Attribute name="granite_texture" template="string" value="Textures/Lava/granite"/>
    </Attributes>
    <Properties>
      <Property name="render" type="ProjectMagma.Simulation.LavaRenderProperty"/>
      <!--Property name="render" type="ProjectMagma.Simulation.BasicRenderProperty"/-->
      <Property name="render_highlight" type="ProjectMagma.Simulation.RenderHighlightProperty"/>
    </Properties>
  </Entity>


  <Entity name="pillar_base" abstract="true">
    <Attributes>
      <Attribute name="kind" template="string" value="pillar"/>
      <Attribute name="position" template="float3" value="230 0 260"/>
      <Attribute name="scale" template="float3" value="200 200 200"/>
      <Attribute name="bv_type" template="string" value="alignedbox3tree"/>
      <Attribute name="diffuse_texture" template="string" value="Textures/Environment/environ_diffuse"/>
      <Attribute name="lava_light_strength" template="float" value="1.0"/>
      <Attribute name="diffuse_color" template="float3" value="1.0 1.0 1.0"/>
      <Attribute name="specular_color" template="float3" value="0.05 0.05 0.05"/>
      <Attribute name="env_ground_waves_amplitude" template="float" value="15.0"/>
      <Attribute name="env_ground_waves_frequency" template="float" value="0.002"/>
      <Attribute name="env_ground_waves_hardness" template="float" value="5.5"/>
      <Attribute name="env_ground_waves_velocity" template="float" value="0.003"/>
    </Attributes>
    <Properties>
      <Property name="collision" type="ProjectMagma.Simulation.Collision.CollisionProperty"/>
      <Property name="render" type="ProjectMagma.Simulation.EnvironmentRenderProperty"/>
      <Property name="render_highlight" type="ProjectMagma.Simulation.RenderHighlightProperty"/>
    </Properties>
  </Entity>

  <Entity name="cave_base" abstract="true">
    <Attributes>
      <Attribute name="kind" template="string" value="cave"/>
      <Attribute name="position" template="float3" value="0 -20 90"/>
      <Attribute name="scale" template="float3" value="800 800 800"/>
      <Attribute name="mesh" template="string" value="Models/Environment/cave_grp"/>
      <Attribute name="bv_type" template="string" value="alignedbox3tree"/>
      <Attribute name="diffuse_texture" template="string" value="Textures/Environment/cave_diffuse_v001"/>
      <!--Attribute name="diffuse_texture" template="string" value="Textures/custom_uv_diag"/-->
      <Attribute name="lava_light_strength" template="float" value="1.0"/>
      <Attribute name="spot_light_strength" template="float" value="1.0"/>
      <Attribute name="diffuse_color" template="float3" value="1.0 1.0 1.0"/>
      <Attribute name="specular_color" template="float3" value="0.15 0.15 0.15"/>
      <Attribute name="specular_texture" template="string" value="Textures/Environment/cave_SPEC_v001"/>
      <Attribute name="env_ground_waves_amplitude" template="float" value="45"/>
      <Attribute name="env_ground_waves_frequency" template="float" value="0.00025"/>
      <Attribute name="env_ground_waves_hardness" template="float" value="15"/>
      <Attribute name="env_ground_waves_velocity" template="float" value="0.002"/>
    </Attributes>
    <Properties>
      <Property name="render" type="ProjectMagma.Simulation.EnvironmentRenderProperty"/>
      <Property name="collision" type="ProjectMagma.Simulation.Collision.CollisionProperty"/>
      <Property name="render_highlight" type="ProjectMagma.Simulation.RenderHighlightProperty"/>
    </Properties>
  </Entity>
  
  <Entity name="pillar_base_001" extends="pillar_base" abstract="true">
    <Attributes>
      <Attribute name="mesh" template="string" value="Models/Pillars/pillar_001"/>
    </Attributes>
  </Entity>

  <Entity name="pillar_base_002" extends="pillar_base" abstract="true">
    <Attributes>
      <Attribute name="mesh" template="string" value="Models/Pillars/pillar_002"/>
    </Attributes>
  </Entity>

  <Entity name="pillar_base_003" extends="pillar_base" abstract="true">
    <Attributes>
      <Attribute name="mesh" template="string" value="Models/Pillars/pillar_003"/>
    </Attributes>
  </Entity>
  
  <Entity name="powerup_base" abstract="true">
    <Attributes>
      <Attribute name="kind" template="string" value="powerup"/>
      <Attribute name="position" template="float3" value="0 0 0"/>
      <Attribute name="mesh" template="string" value="Models/Primitives/powerup"/>
      <Attribute name="scale" template="float3" value="12 12 12"/>
      <Attribute name="relative_position" template="float3" value="15 0 15"/>
      <Attribute name="pickup_sound" template="string" value="excellent"/>
      <Attribute name="bv_type" template="string" value="sphere"/>
      <Attribute name="diffuse_color" template="float3" value="1.0 1.0 1.0"/>
      <Attribute name="emissive_color" template="float3" value="0.0 0.0 0.0"/>
      <Attribute name="alpha" template="float" value="0.85"/>
      <Attribute name="persistent_squash" template="float2" value="1400.0 1.0"/>
    </Attributes>
    <Properties>
      <Property name="collision" type="ProjectMagma.Simulation.Collision.CollisionProperty"/>
      <Property name="shadow_cast" type="ProjectMagma.Simulation.ShadowCastProperty"/>
      <Property name="render" type="ProjectMagma.Simulation.BasicRenderProperty"/>
      <Property name="render_highlight" type="ProjectMagma.Simulation.RenderHighlightProperty"/>
    </Properties>
  </Entity>

  <Entity name="powerup_health" extends="powerup_base" abstract="true">
    <Attributes>
      <Attribute name="value" template="int" value="100"/>
      <Attribute name="diffuse_color" template="float3" value="0.9 0.5 0.5"/>
      <Attribute name="emissive_color" template="float3" value="0.1 0.0 0.0"/>
    </Attributes>
    <Properties>
      <Property name="controller" type="ProjectMagma.Simulation.PowerUpControllerHealth"/>
    </Properties>
  </Entity>

  <Entity name="powerup_energy" extends="powerup_base" abstract="true">
    <Attributes>
      <Attribute name="value" template="int" value="100"/>
      <Attribute name="diffuse_color" template="float3" value="0.5 0.5 0.9"/>
      <Attribute name="emissive_color" template="float3" value="0.0 0.0 0.1"/>
    </Attributes>
    <Properties>
      <Property name="controller" type="ProjectMagma.Simulation.PowerUpControllerEnergy"/>
    </Properties>
  </Entity>

  <Entity name="powerup_jumps" extends="powerup_base" abstract="true">
    <Attributes>
      <Attribute name="value" template="int" value="10"/>
      <Attribute name="diffuse_color" template="float3" value="0.5 0.9 0.5"/>
      <Attribute name="emissive_color" template="float3" value="0.0 0.1 0.0"/>
    </Attributes>
    <Properties>
      <Property name="controller" type="ProjectMagma.Simulation.PowerUpControllerJumps"/>
    </Properties>
  </Entity>

  <Entity name="powerup_repulsion" extends="powerup_base" abstract="true">
    <Attributes>
      <Attribute name="value" template="float" value="6"/>
      <Attribute name="diffuse_color" template="float3" value="0.9 0.9 0.5"/>
      <Attribute name="emissive_color" template="float3" value="0.1 0.1 0.0"/>
    </Attributes>
    <Properties>
      <Property name="controller" type="ProjectMagma.Simulation.PowerUpControllerRepulsion"/>
    </Properties>
  </Entity>

</Level>