<?xml version="1.0" encoding="utf-8" ?>
<!DOCTYPE Level SYSTEM "..\..\Common\Levels.dtd">
<Level>

  <Includes>
    <Include name="Level\Common\Constants.xml"/>
    <Include name="Level\Common\Templates.xml"/>
  </Includes>

  <Entity name="sound" extends="sound_base">
    <Attributes>
      <Attribute name="background_music" template="string" value="Music/menu_level1"/>
    </Attributes>
  </Entity>


  <Entity name="player_constants" extends="player_constants_base">
  </Entity>

  <Entity name="island_constants" extends="island_constants_base">
  </Entity>

  <Entity name="powerup_constants" extends="powerup_constants_base">
  </Entity>
  
  <!-- "unique" game entities -->

  <Entity name="lava" extends="lava_base">
    <Attributes>
      <Attribute name="firefractal_texture" template="string" value="Textures/Lava/firefractal_orange"/>
    </Attributes>
    <!-- don't mess with the lava, there is nothing to change here. -->
    <!-- if you know what you are doing, do it in the template. -->
  </Entity>
  <Entity name="cave" extends="cave_base">
    <!-- don't mess with the cave, there is nothing to change here. -->
    <!-- if you know what you are doing, do it in the template. -->
  </Entity>


</Level>