<?xml version="1.0" encoding="utf-8" ?>
<!DOCTYPE Level SYSTEM "..\..\Common\Levels.dtd">
<Level>

  <Includes>
    <Include name="Level\Common\Constants.xml"/>
    <Include name="Level\Common\Templates.xml"/>
  </Includes>

  <Entity name="sound" extends="sound_base">
  </Entity>
  
  <!-- "unique" game entities -->

  <Entity name="lava" extends="lava_base">
    <!-- don't mess with the lava, there is nothing to change here. -->
    <!-- if you know what you are doing, do it in the template. -->
    <Attributes>
      <Attribute name="firefractal_texture" template="string" value="Textures/Lava/firefractal_orange"/>
    </Attributes>
  </Entity>

  <Entity name="cave" extends="cave_base">
    <!-- don't mess with the cave, there is nothing to change here. -->
    <!-- if you know what you are doing, do it in the template. -->
  </Entity>

  <!-- masses of game elements... -->

   <Entity name="island1" extends="island_base_grass3">
    <Attributes>
      <Attribute name="position" template="float3" value="0 150 0"/>
      <Attribute name="scale" template="float3" value="550 550 550"/>
      <Attribute name="sinking_speed" template="float" value="0"/>

      <Attribute name="landing_offset_p1" template="float3" value="-100 150 -100"/>
      <Attribute name="landing_offset_p2" template="float3" value="-100 150 100"/>
      <Attribute name="landing_offset_p3" template="float3" value="100 150 -100"/>
      <Attribute name="landing_offset_p4" template="float3" value="100 150 100"/>

      <Attribute name="allow_props_collision" template="bool" value="true"/>
    </Attributes>
     <Properties>
       <Property name="controller" type="ProjectMagma.Simulation.IslandNoMovementControllerProperty"/>
     </Properties>
   </Entity>


  <Entity name="powerup1" extends="powerup_health">
    <Attributes>
      <Attribute name="island_reference" template="string" value="island1"/>
      <Attribute name="relative_position" template="float3" value="100 10 100"/>
    </Attributes>
  </Entity>

  <Entity name="powerup2" extends="powerup_energy">
    <Attributes>
      <Attribute name="island_reference" template="string" value="island1"/>
      <Attribute name="relative_position" template="float3" value="-100 10 -100"/>
    </Attributes>
  </Entity>

</Level>