<?xml version="1.0" encoding="utf-8" ?>
<!DOCTYPE Level SYSTEM "..\..\Common\Levels.dtd">
<Level>

  <Includes>
    <Include name="Level\Common\Constants.xml"/>
    <Include name="Level\Common\Templates.xml"/>
  </Includes>

  <Entity name="sound" extends="sound_base">
    <Attributes>
      <Attribute name="background_music" template="string" value="Music/background_janick"/>
    </Attributes>
  </Entity>

  <Entity name="player_constants" extends="player_constants_base">
  </Entity>

  <Entity name="island_constants" extends="island_constants_base">
  </Entity>

  <Entity name="powerup_constants" extends="powerup_constants_base">
  </Entity>


  <!-- "unique" game entities -->

  <Entity name="lava" extends="lava_base">
    <Attributes>
      <Attribute name="firefractal_texture" template="string" value="Textures/Lava/firefractal_orange"/>
    </Attributes>
    <!-- don't mess with the lava, there is nothing to change here. -->
    <!-- if you know what you are doing, do it in the template. -->
  </Entity>
  <Entity name="cave" extends="cave_base">
    <!-- don't mess with the cave, there is nothing to change here. -->
    <!-- if you know what you are doing, do it in the template. -->
  </Entity>

  <!-- masses of game elements... -->

  <Entity name="pillar1" extends="pillar_base_001">
    <Attributes>
      <Attribute name="position" template="float3" value="200 -50 200"/>
    </Attributes>
  </Entity>

  <Entity name="pillar2" extends="pillar_base_002">
    <Attributes>
      <Attribute name="position" template="float3" value="200 -50 -200"/>
    </Attributes>
  </Entity>

  <Entity name="pillar3" extends="pillar_base_002">
    <Attributes>
      <Attribute name="position" template="float3" value="-200 -50 200"/>
    </Attributes>
  </Entity>

  <Entity name="pillar4" extends="pillar_base_001">
    <Attributes>
      <Attribute name="position" template="float3" value="-200 -20 -200"/>
    </Attributes>
  </Entity>

  <Entity name="island1" extends="island_base_grass1">
    <Attributes>
      <Attribute name="position" template="float3" value="330 200 330"/>
    </Attributes>
  </Entity>

  <Entity name="island2" extends="island_base_grass1">
    <Attributes>
      <Attribute name="position" template="float3" value="330 200 -330"/>
    </Attributes>
  </Entity>

  <Entity name="island3" extends="island_base_grass1">
    <Attributes>
      <Attribute name="position" template="float3" value="-330 200 330"/>
    </Attributes>
  </Entity>

  <Entity name="island4" extends="island_base_grass1">
    <Attributes>
      <Attribute name="position" template="float3" value="-330 200 -330"/>
    </Attributes>
  </Entity>

  <Entity name="island5" extends="island_base_burnt1">
    <Attributes>
      <Attribute name="position" template="float3" value="0 -25 0"/>
      <Attribute name="direction" template="float3" value="0 0 -1"/>
    </Attributes>
    <Properties>
      <Property name="controller" type="ProjectMagma.Simulation.IslandStraightMovementControllerProperty"/>
    </Properties>
  </Entity>

  <Entity name="powerup1" extends="powerup_health">
    <Attributes>
      <Attribute name="island_reference" template="string" value="island4"/>
      <Attribute name="relative_position" template="float3" value="15 10 15"/>
    </Attributes>
  </Entity>

  <Entity name="powerup2" extends="powerup_energy">
    <Attributes>
      <Attribute name="island_reference" template="string" value="island2"/>
      <Attribute name="relative_position" template="float3" value="-20 10 -5"/>
    </Attributes>
  </Entity>

  <Entity name="powerup3" extends="powerup_life">
    <Attributes>
      <Attribute name="island_reference" template="string" value="island5"/>
      <Attribute name="relative_position" template="float3" value="-20 10 -5"/>
      <Attribute name="fixed" template="bool" value="true"/>

      <Attribute name="respawn_min_time" template="float" value="12000"/>
      <Attribute name="respawn_random_time" template="float" value="24000"/>
    </Attributes>
  </Entity>

</Level>