<?xml version="1.0" encoding="utf-8" ?>
<!DOCTYPE Level SYSTEM "../../Common/Levels.dtd">
<Level>

  <Includes>
    <Include name="Level\Common\Renderer\Templates.xml"/>
  </Includes>

  <Entity name="respawn_spot" extends="respawn_spot_base">
  </Entity>

  <Entity name="lavafire" extends="lavafire_base">
  </Entity>

  <Entity name="snow" extends="snow_base">
  </Entity>

  <Entity name="fog" extends="fog_base">
  </Entity>

  <Entity name="lava" extends="lava_base">
  </Entity>

  <Entity name="environment" extends="environment_base">
  </Entity>

  <Entity name="lights" extends="lights_base">
  </Entity>

  <Entity name="tonemapping" extends="tonemapping_base">
  </Entity>

  <Entity name="topoverlay" extends="topoverlay_base">
  </Entity>

</Level>