<?xml version="1.0" encoding="utf-8" ?>
<!DOCTYPE Level SYSTEM "Levels.dtd">
<Level>

  <!-- constants -->

  <Entity name="constants_base" abstract="true">
    <Attributes>
      <Attribute name="gravity_acceleration" template="float3" value="0 -900 0"/>
      <Attribute name="max_gravity_speed" template="float" value="450"/>
    </Attributes>
  </Entity>
  
  <Entity name="player_constants_base" extends="constants_base" abstract="true">
    <Attributes>
      <Attribute name="respawn_time" template="int" value="1000"/>
      <Attribute name="respawn_min_distance_to_players" template="float" value="150"/>

      <Attribute name="max_health" template="int" value="100"/>
      <Attribute name="max_energy" template="int" value="100"/>
      <Attribute name="max_fuel" template="int" value="2500"/>

      <Attribute name="arrow_island_min_distance_factor" template="float" value="0.2"/>
      <Attribute name="arrow_island_max_distance_factor" template="float" value="0.90"/>
      <Attribute name="arrows_per_second" template="float" value="2.2"/>

      <Attribute name="lava_damage_per_second" template="int" value="100"/>
      <Attribute name="energy_recharge_per_second" template="int" value="8"/>

      <Attribute name="fuel_recharge_multiplier" template="float" value="1.2"/>
      <Attribute name="fuel_recharge_multiplier_island" template="float" value="4"/>
      <Attribute name="max_jetpack_speed" template="float" value="200"/>
      <Attribute name="jetpack_acceleration" template="float3" value="0 1600 0"/>

      <Attribute name="simple_jump_gravity_acceleration" template="float3" value="0 -2000 0"/>
      <Attribute name="simple_jump_height" template="float" value="100"/>
      
      <Attribute name="ice_spike_aim_angle" template="float" value="240"/>
      <Attribute name="ice_spike_energy_cost" template="int" value="35"/>
      <Attribute name="ice_spike_damage" template="int" value="25"/>
      <Attribute name="ice_spike_freeze_time" template="int" value="2500"/>
      <Attribute name="ice_spike_cooldown" template="int" value="1200"/>
      <Attribute name="ice_spike_rising_time" template="int" value="500"/>
      <Attribute name="ice_spike_initial_speed_multiplier" template="float3" value="0 300 0"/>
      <Attribute name="ice_spike_max_speed" template="float" value="440"/>
      <Attribute name="ice_spike_gravity_acceleration" template="float3" value="0 -200 0"/>
      <Attribute name="ice_spike_homing_acceleration" template="float" value="5000"/>
      <Attribute name="ice_spike_pillar_force_radius" template="float" value="15"/>
      <Attribute name="ice_spike_island_force_radius" template="float" value="60"/>
      <Attribute name="ice_spike_lifetime" template="int" value="6000"/>
      <Attribute name="ice_spike_death_timeout" template="int" value="3500"/>

      <Attribute name="running_energy_cost_per_second" template="int" value="12"/>
      <Attribute name="frozen_slowdown_divisor" template="float" value="6"/>

      <Attribute name="flamethrower_aim_angle" template="float" value="90"/>
      <Attribute name="flamethrower_warmup_time" template="int" value="1000"/>
      <Attribute name="flamethrower_warmup_energy_cost" template="int" value="15"/>
      <Attribute name="flamethrower_energy_per_second" template="int" value="5"/>
      <Attribute name="flamethrower_cooldown_time" template="int" value="600"/>
      <Attribute name="flamethrower_turn_flame_increase" template="float" value="1"/>
      <Attribute name="flamethrower_turn_scale" template="float" value="0.6"/>
      <Attribute name="flamethrower_damage_per_second" template="int" value="40"/>
      <Attribute name="flamethrower_after_burn_time" template="int" value="300"/>
      <Attribute name="flamethrower_offset" template="float3" value="-12 45 -20"/>

      <Attribute name="hit_damage" template="int" value="20"/>
      <Attribute name="hit_cooldown" template="int" value="250"/>
      <Attribute name="hit_pushback_velocity_multiplier" template="float3" value="500 200 500"/>
      <Attribute name="player_pushback_deacceleration" template="float" value="600"/>
      <Attribute name="player_pushback_velocity_multiplier" template="float" value="120"/>

      <Attribute name="island_aim_angle" template="float" value="360"/>
      <Attribute name="island_aim_angle_eps" template="float" value="30"/>
      <Attribute name="island_reselection_max_value" template="float" value="0.9"/>
      <Attribute name="island_reselection_timeout" template="float" value="100"/>
      <Attribute name="island_deselection_timeout" template="float" value="200"/>
      <Attribute name="island_jump_free_range" template="float" value="250"/>
      <Attribute name="island_jump_arc_height" template="float" value="220"/>
      <Attribute name="island_jump_speed" template="float" value="20"/>

      <Attribute name="island_repulsion_start_velocity_multiplier" template="float" value="60"/>
      <Attribute name="island_repulsion_acceleration" template="float" value="1000"/>
      <Attribute name="island_repulsion_start_min_energy" template="int" value="10"/>
      <Attribute name="island_repulsion_start_energy_cost" template="int" value="6"/>
      <Attribute name="island_repulsion_energy_cost_per_second" template="int" value="16"/>

      <Attribute name="island_non_walking_range_multiplier" template="float" value="12"/>
      <Attribute name="island_non_walking_inwards_acceleration" template="float" value="2000"/>
      <Attribute name="x_axis_walk_multiplier" template="float" value="140"/>
      <Attribute name="z_axis_walk_multiplier" template="float" value="140"/>
      <Attribute name="x_axis_run_multiplier" template="float" value="330"/>
      <Attribute name="z_axis_run_multiplier" template="float" value="330"/>
      <Attribute name="x_axis_jetpack_multiplier" template="float" value="200"/>
      <Attribute name="z_axis_jetpack_multiplier" template="float" value="200"/>
    </Attributes>
  </Entity>

  <Entity name="island_constants_base" extends="constants_base" abstract="true">
    <Attributes>
      <!-- all islands -->
      <Attribute name="movement_acceleration" template="float" value="600"/>

      <Attribute name="rising_delay" template="int" value="800"/>
      <Attribute name="repositioning_acceleraton" template="float" value="800" />

      <Attribute name="scale_health_multiplier" template="float" value="1.8"/>

      <Attribute name="repulsion_deacceleration" template="float" value="400"/>
      <Attribute name="collision_damping" template="float" value="0.9"/>

      <!-- circular moving islands-->
      <Attribute name="angle_speed" template="float" value="0.6"/>
      <Attribute name="contact_pushback_multiplier" template="float" value="200"/>

      <!-- physical islands -->
      <Attribute name="random_strength" template="float" value="1200"/>
      <Attribute name="max_velocity" template="float" value="100"/>
      <Attribute name="damping" template="float" value="0.001"/>

      <Attribute name="pillar_elasticity" template="float" value="0.1"/>
      <Attribute name="pillar_attraction" template="float" value="0.0001"/>
      <Attribute name="pillar_repulsion" template="float" value="0.03"/>
    </Attributes>
  </Entity>

  <Entity name="powerup_constants_base" extends="constants_base" abstract="true">
    <Attributes>
      <Attribute name="respawn_min_time" template="float" value="5000"/>
      <Attribute name="respawn_random_time" template="float" value="10000"/>

      <Attribute name="respawn_min_distance_to_others" template="float" value="200"/>
    </Attributes>
  </Entity>
  
</Level>