<?xml version="1.0" encoding="utf-8" ?>
<!DOCTYPE Level SYSTEM "../../Common/Levels.dtd">
<Level>

  <Includes>
    <Include name="Level\Common\Constants.xml"/>
    <Include name="Level\Common\Templates.xml"/>
  </Includes>


  <Entity name="player_constants" extends="player_constants_base">
  </Entity>

  <Entity name="island_constants" extends="island_constants_base">
  </Entity>

  <Entity name="powerup_constants" extends="powerup_constants_base">
  </Entity>
  
  
  <Entity name="sound" extends="sound_base">
    <Attributes>
      <Attribute name="background_music" template="string" value="Music/menu_level1:0.8"/>
    </Attributes>
  </Entity>

  <!-- "unique" game entities -->

  <Entity name="lava" extends="lava_base">
    <Attributes>
      <Attribute name="firefractal_texture" template="string" value="Textures/Lava/firefractal_orange"/>
    </Attributes>
    <!-- don't mess with the lava, there is nothing to change here. -->
    <!-- if you know what you are doing, do it in the template. -->
  </Entity>

  <Entity name="cave" extends="cave_base">
    <!-- don't mess with the cave, there is nothing to change here. -->
    <!-- if you know what you are doing, do it in the template. -->
  </Entity>

  
  <!-- masses of game elements... -->

  <Entity name="pillar1" extends="pillar_base_001">
    <Attributes>
      <Attribute name="position" template="float3" value="230 -50 260"/>
    </Attributes>
  </Entity>

  <Entity name="pillar2" extends="pillar_base_003">
    <Attributes>
      <Attribute name="position" template="float3" value="-300 -50 150"/>
    </Attributes>
  </Entity>

  <Entity name="pillar3" extends="pillar_base_002">
    <Attributes>
      <Attribute name="position" template="float3" value="200 -50 -120"/>
    </Attributes>
  </Entity>

  <Entity name="pillar4" extends="pillar_base_001">
    <Attributes>
      <Attribute name="position" template="float3" value="-100 -20 0"/>
    </Attributes>
  </Entity>

  <Entity name="pillar5" extends="pillar_base_003">
    <Attributes>
      <Attribute name="position" template="float3" value="10 -20 -300"/>
    </Attributes>
  </Entity>



  <Entity name="island1" extends="island_base_burnt1">
    <Attributes>
      <Attribute name="position" template="float3" value="-150 65 120"/>
      <Attribute name="fixed" template="bool" value="false"/>
    </Attributes>
    <Properties>
      <Property name="controller" type="ProjectMagma.Simulation.IslandNoMovementControllerProperty"/>
    </Properties>
  </Entity>

  <Entity name="island1a" extends="island_base_burnt1">
    <Attributes>
      <Attribute name="position" template="float3" value="-0 65 120"/>
      <Attribute name="fixed" template="bool" value="false"/>

      <!-- new test texture -->
      <Attribute name="diffuse_texture" template="string" value="Textures/Environment/environ_diffuse_test_alpha"/>
    </Attributes>
    <Properties>
      <Property name="controller" type="ProjectMagma.Simulation.IslandNoMovementControllerProperty"/>

      <!-- test alpha rendering -->
      <Property name="render" type="ProjectMagma.Simulation.AlphaIslandRenderProperty"/>
    </Properties>
  </Entity>

  <Entity name="island2" extends="island_base_burnt2">
    <Attributes>
      <Attribute name="position" template="float3" value="150 100 160"/>
    </Attributes>
    <Properties>
      <Property name="controller" type="ProjectMagma.Simulation.IslandNoMovementControllerProperty"/>
    </Properties>
  </Entity>

  <Entity name="island4" extends="island_base_grass1">
    <Attributes>
      <Attribute name="position" template="float3" value="350 180 120"/>
    </Attributes>
    <Properties>
      <Property name="controller" type="ProjectMagma.Simulation.IslandNoMovementControllerProperty"/>
    </Properties>
  </Entity>

  <Entity name="island6" extends="island_base_grass1">
    <Attributes>
      <Attribute name="position" template="float3" value="60 200 -30"/>
    </Attributes>
    <Properties>
      <Property name="controller" type="ProjectMagma.Simulation.IslandNoMovementControllerProperty"/>
    </Properties>
  </Entity>

  <Entity name="island8" extends="island_base_grass3">
    <Attributes>
      <Attribute name="position" template="float3" value="-250 240 220"/>
    </Attributes>
    <Properties>
      <Property name="controller" type="ProjectMagma.Simulation.IslandNoMovementControllerProperty"/>
    </Properties>
  </Entity>

  <Entity name="island10" extends="island_base_grass2">
    <Attributes>
      <Attribute name="position" template="float3" value="-90 280 -280"/>
    </Attributes>
    <Properties>
      <Property name="controller" type="ProjectMagma.Simulation.IslandNoMovementControllerProperty"/>
    </Properties>
  </Entity>

  <Entity name="island12" extends="island_base_ice2">
    <Attributes>
      <Attribute name="position" template="float3" value="-140 400 -240"/>
      <Attribute name="fixed" template="bool" value="false"/>
    </Attributes>
    <Properties>
      <Property name="controller" type="ProjectMagma.Simulation.IslandNoMovementControllerProperty"/>
    </Properties>
  </Entity>

  <Entity name="island13" extends="island_base_ice3">
    <Attributes>
      <Attribute name="position" template="float3" value="140 330 240"/>
    </Attributes>
    <Properties>
      <Property name="controller" type="ProjectMagma.Simulation.IslandNoMovementControllerProperty"/>
    </Properties>
  </Entity>

  

  <Entity name="powerup1" extends="powerup_health">
    <Attributes>
      <Attribute name="island_reference" template="string" value="island4"/>
      <Attribute name="relative_position" template="float3" value="15 10 15"/>
    </Attributes>
  </Entity>

  <Entity name="powerup2" extends="powerup_energy">
    <Attributes>
      <Attribute name="island_reference" template="string" value="island2"/>
      <Attribute name="relative_position" template="float3" value="-20 10 -5"/>
    </Attributes>
  </Entity>

  <!--
  <Entity name="powerup3" extends="powerup_jumps">
    <Attributes>
      <Attribute name="island_reference" template="string" value="island11"/>
      <Attribute name="relative_position" template="float3" value="20 10 10"/>
    </Attributes>
  </Entity>

  <Entity name="powerup4" extends="powerup_repulsion">
    <Attributes>
      <Attribute name="island_reference" template="string" value="island12"/>
      <Attribute name="relative_position" template="float3" value="20 10 10"/>
    </Attributes>
  </Entity>
  -->

</Level>