<?xml version="1.0" encoding="utf-8" ?>
<!DOCTYPE Level SYSTEM "Levels.dtd">
<Level>

  <!-- constants -->

  <Entity name="player_constants">
    <Attributes>
      <Attribute name="respawn_time" template="int" value="1000"/>

      <Attribute name="max_health" template="int" value="100"/>
      <Attribute name="max_energy" template="int" value="100"/>
      <Attribute name="max_fuel" template="int" value="2500"/>

      <Attribute name="energy_recharge_interval" template="int" value="200"/>

      <Attribute name="fuel_recharge_multiplier" template="float" value="0.75"/>
      <Attribute name="fuel_recharge_multiplier_island" template="float" value="1.2"/>
      <Attribute name="max_jetpack_speed" template="float" value="150"/>
      <Attribute name="jetpack_acceleration" template="float3" value="0 1300 0"/>

      <Attribute name="gravity_acceleration" template="float3" value="0 -900 0"/>
      <Attribute name="max_gravity_speed" template="float" value="450"/>

      <Attribute name="pushback_contact_velocity_multiplier" template="float" value="80"/>
      <Attribute name="pushback_deacceleration_multiplier" template="float" value="300"/>

      <Attribute name="ice_spike_speed" template="float" value="300"/>
      <Attribute name="ice_spike_up_speed" template="float" value="200"/>
      <Attribute name="ice_spike_aim_angle" template="float" value="45"/>
      <Attribute name="ice_spike_energy_cost" template="int" value="2"/>
      <Attribute name="ice_spike_damage" template="int" value="1"/>
      <Attribute name="ice_spike_freeze_time" template="int" value="200"/>
      <Attribute name="ice_spike_cooldown" template="int" value="50"/>

      <Attribute name="flamethrower_warmup_time" template="int" value="600"/>
      <Attribute name="flamethrower_warmup_energy_cost" template="int" value="20"/>
      <Attribute name="flamethrower_energy_per_second" template="int" value="5"/>
      <Attribute name="flamethrower_cooldown_time" template="int" value="400"/>
      <Attribute name="flamethrower_turn_flame_increase" template="float" value="1"/>
      <Attribute name="flamethrower_turn_scale" template="float" value="0.6"/>
      <Attribute name="flamethrower_player_damage_per_second" template="int" value="8"/>
      <Attribute name="flamethrower_island_damage_per_second" template="int" value="50"/>

      <Attribute name="hit_damage" template="int" value="20"/>
      <Attribute name="hit_cooldown" template="int" value="250"/>
      <Attribute name="hit_pushback_velocity_multiplier" template="float" value="200"/>

      <Attribute name="x_axis_movement_multiplier" template="float" value="140"/>
      <Attribute name="z_axis_movement_multiplier" template="float" value="140"/>
      <Attribute name="x_axis_jetpack_multiplier" template="float" value="200"/>
      <Attribute name="z_axis_jetpack_multiplier" template="float" value="200"/>
    </Attributes>
  </Entity>

  <Entity name="island_constants">
    <Attributes>
      <Attribute name="random_strength" template="float" value="1200"/>
      <Attribute name="max_velocity" template="float" value="100"/>
      <Attribute name="damping" template="float" value="0.001"/>

      <Attribute name="pillar_elasticity" template="float" value="0.1"/>
      <Attribute name="pillar_attraction" template="float" value="0.0001"/>
      <Attribute name="pillar_repulsion" template="float" value="0.03"/>
      <Attribute name="sinking_speed" template="float" value="20.0"/>
      <Attribute name="rising_speed" template="float" value="30.0"/>
    </Attributes>
  </Entity>

</Level>