<?xml version="1.0" encoding="utf-8" ?>
<!DOCTYPE Level SYSTEM "Levels.dtd">
<Level>
  
  <Entity name="robot_base" abstract="true">
    <Attributes>
      <Attribute name="kind" template="string" value="player"/>
      <Attribute name="position" template="float3" value="0 0 0"/>
      <Attribute name="scale" template="float3" value="10 10 10"/>
      <Attribute name="bv_type" template="string" value="alignedbox3tree"/>
      <Attribute name="specular_color" template="float3" value="0.5 0.5 0.5"/>
      <Attribute name="specular_power" template="float" value="30"/>
      <Attribute name="emissive_color" template="float3" value="0.25 0.25 0.25"/>
      <Attribute name="alpha" template="float" value="1.0"/>
    </Attributes>
    <Properties>
      <Property name="collision" type="ProjectMagma.Simulation.Collision.CollisionProperty"/>
      <Property name="controller" type="ProjectMagma.Simulation.PlayerControllerProperty"/>
      <Property name="burnable" type="ProjectMagma.Simulation.BurnableProperty"/>
      <Property name="hud" type="ProjectMagma.Simulation.HUDProperty"/>
    </Properties>
  </Entity>

  <Entity name="rendered_robot_base" extends="robot_base" abstract="true">
    <Attributes>
      <Attribute name="mesh" template="string" value="Models/Player/robot_grp"/>
      <Attribute name="diffuse_texture" template="string" value="Textures/Player/robot_texture10"/>
      <Attribute name="specular_texture" template="string" value="Textures/Player/robot_spec"/>      
    </Attributes>
    <Properties>
      <Property name="render" type="ProjectMagma.Simulation.RobotRenderProperty"/>
    </Properties>
    </Entity>
  
  <Entity name="green_robot" extends="rendered_robot_base" abstract="true" >
      <Attributes>
        <Attribute name="color1" template="float3" value="0.24 0.84 0.16"/>
        <Attribute name="color2" template="float3" value="0.58 0.82 0.15"/>
      </Attributes>
  </Entity>

  <Entity name="orange_robot" extends="rendered_robot_base" abstract="true" >
    <Attributes>
      <Attribute name="color1" template="float3" value="0.97 0.51 0.17"/>
      <Attribute name="color2" template="float3" value="0.97 0.84 0.17"/>
    </Attributes>
  </Entity>

  <Entity name="blue_robot" extends="rendered_robot_base" abstract="true" >
    <Attributes>
      <Attribute name="color1" template="float3" value="0.15 0.51 0.83"/>
      <Attribute name="color2" template="float3" value="0.27 0.85 0.79"/>
    </Attributes>
  </Entity>

  <Entity name="purple_robot" extends="rendered_robot_base" abstract="true" >
    <Attributes>
      <Attribute name="color1" template="float3" value="0.91 0.08 0.64"/>
      <Attribute name="color2" template="float3" value="0.77 0.08 0.86"/>
    </Attributes>
  </Entity>  
  
</Level>