<?xml version="1.0" encoding="utf-8" ?>
<!DOCTYPE Level SYSTEM "Levels.dtd">
<Level>

  <Entity name="island_base" abstract="true">
    <Attributes>
      <Attribute name="kind" template="string" value="island"/>

      <Attribute name="position" template="float3" value="60 160 -30"/>
      <Attribute name="landing_offset" template="float3" value="0 70 0"/>
      <Attribute name="scale" template="float3" value="70 70 70"/>
      
      <Attribute name="velocity" template="float3" value="0 0 0"/>
      
      <Attribute name="diffuse_texture" template="string" value="Textures/Environment/environ_diffuse"/>
      <!--Attribute name="diffuse_texture" template="string" value="Textures/xna_logo"/-->
      <Attribute name="bv_type" template="string" value="alignedbox3tree"/>
      <Attribute name="lava_light_strength" template="float" value="10.0"/>
      
      <Attribute name="interactable" template="bool" value="false"/>

      <Attribute name="sinking_speed" template="float" value="14.0"/>
    </Attributes>
    <Properties>
      <Property name="collision" type="ProjectMagma.Simulation.Collision.CollisionProperty"/>
      <Property name="controller" type="ProjectMagma.Simulation.IslandCircualarMovementControllerProperty"/>
      <!--<Property name="death" type="ProjectMagma.Simulation.DeathProperty"/>-->
      <Property name="shadow_cast" type="ProjectMagma.Simulation.ShadowCastProperty"/>
      <Property name="render" type="ProjectMagma.Simulation.IslandRenderProperty"/>
      <!--Property name="render" type="ProjectMagma.Simulation.BasicRenderProperty"/-->
      <Property name="render_highlight" type="ProjectMagma.Simulation.RenderHighlightProperty"/>
    </Properties>
  </Entity>

  <!-- xxxxxxxxxxxxxxxxxxxxxxxxxxxxxxxxxxxxxxxxxxxxxxxxxxxxxxxxxxxxxxxxxxxxxxxxxxxxxxxx -->
  
  <Entity name="island_base_burnt" extends="island_base" abstract="true">
    <Attributes>
      <Attribute name="wind_strength" template="float" value="0.0"/>
    </Attributes>
  </Entity>

  <Entity name="island_base_grass" extends="island_base" abstract="true">
    <Attributes>
      <Attribute name="wind_strength" template="float" value="0.03"/>
    </Attributes>
  </Entity>

  <Entity name="island_base_ice" extends="island_base" abstract="true">
    <Attributes>
      <Attribute name="wind_strength" template="float" value="0.0"/>
    </Attributes>
  </Entity>

  <!-- xxxxxxxxxxxxxxxxxxxxxxxxxxxxxxxxxxxxxxxxxxxxxxxxxxxxxxxxxxxxxxxxxxxxxxxxxxxxxxxx -->

  <Entity name="island_base_burnt1" extends="island_base_burnt" abstract="true">
    <Attributes>
      <Attribute name="mesh" template="string" value="Models/Islands/burnt1_grp"/>
      <Attribute name="landing_offset" template="float3" value="30 70 0"/>
    </Attributes>
  </Entity>

  <Entity name="island_base_burnt2" extends="island_base_burnt" abstract="true">
    <Attributes>
      <Attribute name="mesh" template="string" value="Models/Islands/burnt2_grp"/>
    </Attributes>
  </Entity>

  <Entity name="island_base_burnt3" extends="island_base_burnt" abstract="true">
    <Attributes>
      <Attribute name="mesh" template="string" value="Models/Islands/burnt3_grp"/>
    </Attributes>
  </Entity>

  <!-- xxxxxxxxxxxxxxxxxxxxxxxxxxxxxxxxxxxxxxxxxxxxxxxxxxxxxxxxxxxxxxxxxxxxxxxxxxxxxxxx -->

  <Entity name="island_base_grass1" extends="island_base_grass" abstract="true">
    <Attributes>
      <Attribute name="mesh" template="string" value="Models/Islands/grass1_grp"/>
    </Attributes>
  </Entity>

  <Entity name="island_base_grass2" extends="island_base_grass" abstract="true">
    <Attributes>
      <Attribute name="mesh" template="string" value="Models/Islands/grass2_grp"/>
    </Attributes>
  </Entity>

  <Entity name="island_base_grass3" extends="island_base_grass" abstract="true">
    <Attributes>
      <Attribute name="mesh" template="string" value="Models/Islands/grass3_grp"/>
      <Attribute name="landing_offset" template="float3" value="30 70 0"/>
    </Attributes>
  </Entity>

  <Entity name="island_base_grass4" extends="island_base_grass" abstract="true">
    <Attributes>
      <Attribute name="mesh" template="string" value="Models/Islands/grass4_grp"/>
      <Attribute name="landing_offset" template="float3" value="30 70 0"/>
    </Attributes>
  </Entity>

  <!-- xxxxxxxxxxxxxxxxxxxxxxxxxxxxxxxxxxxxxxxxxxxxxxxxxxxxxxxxxxxxxxxxxxxxxxxxxxxxxxxx -->

  <Entity name="island_base_ice1" extends="island_base_ice" abstract="true">
    <Attributes>
      <Attribute name="mesh" template="string" value="Models/Islands/ice1_grp"/>
    </Attributes>
  </Entity>

  <Entity name="island_base_ice2" extends="island_base_ice" abstract="true">
    <Attributes>
      <Attribute name="mesh" template="string" value="Models/Islands/ice2_grp"/>
    </Attributes>
  </Entity>

  <Entity name="island_base_ice3" extends="island_base_ice" abstract="true">
    <Attributes>
      <Attribute name="mesh" template="string" value="Models/Islands/ice3_grp"/>
    </Attributes>
  </Entity>

  <Entity name="island_base_ice4" extends="island_base_ice" abstract="true">
    <Attributes>
      <Attribute name="mesh" template="string" value="Models/Islands/ice4_grp"/>
    </Attributes>
  </Entity>


</Level>